{
  "$schema": "./save-read-reverse-v1.schema.json",
  "manifestVersion": 1,
  "declarationApiVersion": "codemie.epam.com/v1alpha1",
  "source": {
    "backendTag": "2.42.0",
    "backendCommit": "2a481c290c99bf30ef80aadafa03d876a7f5f732",
    "evidenceOnly": true,
    "paths": [
      "codemie/src/codemie/rest_api/routers/assistant.py",
      "codemie/src/codemie/rest_api/models/assistant.py",
      "codemie/src/codemie/rest_api/routers/workflow.py",
      "codemie/src/codemie/core/workflow_models/workflow_config.py",
      "codemie/src/codemie/core/workflow_models/workflow_models.py",
      "codemie/src/codemie/rest_api/routers/skill.py",
      "codemie/src/codemie/rest_api/models/skill.py",
      "codemie/src/codemie/service/skill_service.py",
      "codemie/src/codemie/rest_api/routers/index.py",
      "codemie/src/codemie/rest_api/models/index.py",
      "codemie/src/codemie/service/index/index_service.py",
      "codemie/src/codemie/rest_api/routers/user.py",
      "codemie/src/codemie/service/filter/filter_services.py",
      "codemie/src/codemie/service/mcp/access_control.py"
    ]
  },
  "compatibilityPolicy": {
    "infoVersionIsIdentity": false,
    "unknownContractedField": "E_API_INCOMPATIBLE",
    "missingOrInvalidField": "E_API_INCOMPATIBLE",
    "unclassifiedAuthoringState": "E_API_INCOMPATIBLE",
    "rawBodyRetention": "forbidden"
  },
  "sharedComponentRules": [
    {
      "component": "guardrailAssignment",
      "schemaRef": "../../codemie-cicd-tool/contracts/declaration-v1alpha1.schema.json#/$defs/guardrailAssignment",
      "fieldRules": [
        {
          "path": "guardrail_id",
          "class": "direct-authorable",
          "target": "guardrail_id"
        },
        {
          "path": "mode",
          "class": "direct-authorable",
          "target": "mode"
        },
        {
          "path": "source",
          "class": "direct-authorable",
          "target": "source"
        },
        {
          "path": "editable",
          "class": "direct-authorable",
          "target": "editable"
        },
        {
          "path": "guardrail_name",
          "class": "direct-authorable",
          "target": "guardrail_name"
        }
      ]
    },
    {
      "component": "integrationSelectionFromSettingsBase",
      "schemaRef": "../../codemie-cicd-tool/contracts/declaration-v1alpha1.schema.json#/$defs/integrationSelection",
      "fieldRules": [
        {
          "path": "id",
          "class": "bounded-transform",
          "target": "id",
          "transform": "copy non-empty opaque configuration id"
        },
        {
          "path": "alias",
          "class": "bounded-transform",
          "target": "alias",
          "transform": "copy nullable alias"
        },
        {
          "path": "date",
          "class": "safe-excluded"
        },
        {
          "path": "update_date",
          "class": "safe-excluded"
        },
        {
          "path": "user_id",
          "class": "safe-excluded"
        },
        {
          "path": "created_by",
          "class": "safe-excluded"
        },
        {
          "path": "project_name",
          "class": "safe-excluded"
        },
        {
          "path": "default",
          "class": "safe-excluded"
        },
        {
          "path": "credential_type",
          "class": "safe-excluded"
        },
        {
          "path": "credential_values",
          "class": "secret-or-masked"
        },
        {
          "path": "setting_hash",
          "class": "secret-or-masked"
        },
        {
          "path": "setting_type",
          "class": "safe-excluded"
        },
        {
          "path": "is_global",
          "class": "safe-excluded"
        }
      ]
    },
    {
      "component": "toolkitAndTool",
      "schemaRef": "../../codemie-cicd-tool/contracts/declaration-v1alpha1.schema.json#/$defs/toolkit",
      "fieldRules": [
        {
          "path": "toolkit",
          "class": "direct-authorable",
          "target": "toolkit"
        },
        {
          "path": "label",
          "class": "direct-authorable",
          "target": "label"
        },
        {
          "path": "settings_config",
          "class": "direct-authorable",
          "target": "settings_config"
        },
        {
          "path": "is_external",
          "class": "direct-authorable",
          "target": "is_external"
        },
        {
          "path": "settings",
          "class": "bounded-transform",
          "target": "settings",
          "transform": "integrationSelectionFromSettingsBase; retain id and alias only"
        },
        {
          "path": "tools",
          "class": "bounded-transform",
          "target": "tools",
          "transform": "preserve order and project the closed tool schema"
        },
        {
          "path": "tools[].name",
          "class": "direct-authorable",
          "target": "tools[].name"
        },
        {
          "path": "tools[].label",
          "class": "direct-authorable",
          "target": "tools[].label"
        },
        {
          "path": "tools[].settings_config",
          "class": "direct-authorable",
          "target": "tools[].settings_config"
        },
        {
          "path": "tools[].description",
          "class": "direct-authorable",
          "target": "tools[].description"
        },
        {
          "path": "tools[].user_description",
          "class": "direct-authorable",
          "target": "tools[].user_description"
        },
        {
          "path": "tools[].settings",
          "class": "bounded-transform",
          "target": "tools[].settings",
          "transform": "integrationSelectionFromSettingsBase; retain id and alias only"
        }
      ]
    },
    {
      "component": "mcpServer",
      "schemaRef": "../../codemie-cicd-tool/contracts/declaration-v1alpha1.schema.json#/$defs/mcpServer",
      "fieldRules": [
        {
          "path": "name",
          "class": "direct-authorable",
          "target": "name"
        },
        {
          "path": "description",
          "class": "direct-authorable",
          "target": "description"
        },
        {
          "path": "enabled",
          "class": "direct-authorable",
          "target": "enabled"
        },
        {
          "path": "mcp_config_id",
          "class": "direct-authorable",
          "target": "mcp_config_id"
        },
        {
          "path": "use_custom_config",
          "class": "direct-authorable",
          "target": "use_custom_config"
        },
        {
          "path": "mcp_connect_url",
          "class": "direct-authorable",
          "target": "mcp_connect_url"
        },
        {
          "path": "tools_tokens_size_limit",
          "class": "direct-authorable",
          "target": "tools_tokens_size_limit"
        },
        {
          "path": "command",
          "class": "direct-authorable",
          "target": "command"
        },
        {
          "path": "arguments",
          "class": "direct-authorable",
          "target": "arguments"
        },
        {
          "path": "settings",
          "class": "bounded-transform",
          "target": "settings",
          "transform": "integrationSelectionFromSettingsBase; retain id and alias only"
        },
        {
          "path": "integration_alias",
          "class": "direct-authorable",
          "target": "integration_alias"
        },
        {
          "path": "resolve_dynamic_values_in_arguments",
          "class": "direct-authorable",
          "target": "resolve_dynamic_values_in_arguments"
        },
        {
          "path": "tools",
          "class": "direct-authorable",
          "target": "tools",
          "ordering": "preserve server order"
        },
        {
          "path": "config",
          "class": "secret-or-masked"
        },
        {
          "path": "mcp_connect_auth_token",
          "class": "secret-or-masked"
        }
      ]
    },
    {
      "component": "workflowExecutionConfig",
      "schemaRef": "../../codemie-cicd-tool/contracts/declaration-v1alpha1.schema.json#/$defs/executionConfig",
      "fieldRules": [
        {
          "path": "messages_limit_before_summarization",
          "class": "direct-authorable",
          "target": "messages_limit_before_summarization"
        },
        {
          "path": "tokens_limit_before_summarization",
          "class": "direct-authorable",
          "target": "tokens_limit_before_summarization"
        },
        {
          "path": "type",
          "class": "direct-authorable",
          "target": "type"
        },
        {
          "path": "enable_summarization_node",
          "class": "direct-authorable",
          "target": "enable_summarization_node"
        },
        {
          "path": "recursion_limit",
          "class": "direct-authorable",
          "target": "recursion_limit"
        },
        {
          "path": "max_concurrency",
          "class": "direct-authorable",
          "target": "max_concurrency"
        },
        {
          "path": "verbose",
          "class": "direct-authorable",
          "target": "verbose"
        },
        {
          "path": "max_iteration_key_output_limit",
          "class": "direct-authorable",
          "target": "max_iteration_key_output_limit"
        },
        {
          "path": "assistants",
          "class": "bounded-transform",
          "target": "assistants",
          "transform": "project closed actor fields; apply managed-reference rules below; preserve order"
        },
        {
          "path": "tools",
          "class": "direct-authorable",
          "target": "tools",
          "ordering": "preserve order; nested mcpServer uses shared rule"
        },
        {
          "path": "custom_nodes",
          "class": "direct-authorable",
          "target": "custom_nodes",
          "ordering": "preserve order"
        },
        {